{
  "$schema": "urn:fortress:schema:v1:standard-manifest",
  "schema_version": 1,
  "id": "STD-FORTRESS-ENGINEERING",
  "title": "Fortress Engineering Standard",
  "edition": "1.0.0-draft.2",
  "status": "draft",
  "release_digest": null,
  "rules": [
    "engine/standard_registry/_data/std_id_rule.json",
    "engine/architecture_evaluation/_data/dependency_rule.json",
    "engine/architecture_evaluation/_data/realization_rule.json",
    "engine/architecture_evaluation/_data/semantic_conformance_rule.json",
    "engine/behavioral_semantics/_data/behavior_flow_rule.json",
    "engine/behavioral_realization/_data/behavior_realization_rule.json",
    "engine/behavioral_realization/_data/behavior_bypass_rule.json",
    "engine/semantic_analysis/_data/program_domain_rule.json",
    "engine/state_effect_analysis/_data/program_state_rule.json",
    "engine/state_effect_analysis/_data/program_effect_rule.json",
    "engine/information_flow/_data/program_infoflow_rule.json",
    "engine/environmental_semantics/_data/program_environment_rule.json",
    "engine/environmental_semantics/_data/program_retry_rule.json",
    "engine/environmental_semantics/_data/program_recovery_rule.json",
    "engine/snapshot_governance/_data/ownership_rule.json",
    "engine/snapshot_governance/_data/traceability_rule.json",
    "engine/snapshot_governance/_data/test_boundary_rule.json",
    "engine/snapshot_governance/_data/module_rule.json",
    "engine/snapshot_governance/_data/documentation_rule.json",
    "engine/reference_resolution/_data/reference_rule.json",
    "engine/source_architecture/_data/source_profile_rule.json",
    "engine/source_architecture/_data/source_artifact_rule.json",
    "engine/snapshot_governance/_data/contract_rule.json"
  ]
}
